date,event,category,snippet,source_url
2026-01-02,Pope Leo's potential destinations for 2026,Holiday,"The Church, Vatican events | 29/12/2025. July 2025: Pope returns to Castel Gandolfo for first time in 12 years · The Church | 29/12/2025. VATICAN II (Part 4): ...",https://www.romereports.com/en/2026/01/02/pope-leos-potential-destinations-for-2026/
2026-01-02,"Elon Musk backs Republicans, warns against 'radical left' ...",Holiday,WASHINGTON (TNND) — Billionaire Tesla CEO Elon Musk signaled his support for Republicans on New Year's Day ahead of the 2026 midterm elections after he ...,https://komonews.com/news/nation-world/tesla-space-x-billionaire-elon-musk-backs-republicans-warns-against-radical-left-ahead-of-2026-midterms-president-donald-trump-doge-one-big-beautiful-bill-act-political-donor
2026-01-02,Global Semiconductor Rally Charges into 2026 as Physical AI ...,Political_Event,"The industry reaction was immediate: as Oracle (NYSE: ORCL) announced the deployment of a 50,000-GPU ""Helios"" supercluster in late 2025, the competitive ...",https://markets.financialcontent.com/stocks/article/marketminute-2026-1-2-silicon-supremacy-global-semiconductor-rally-charges-into-2026-as-physical-ai-takes-center-stage
2026-01-02,Tesla's Declining Delivery Momentum and Strategic ...,Media_Reaction,Tesla's Declining Delivery Momentum and Strategic Rebalancing: Assessing the Long-Term Investment Implications. Jan.02 2026 ...,https://www.ainvest.com/news/tesla-declining-delivery-momentum-strategic-rebalancing-assessing-long-term-investment-implications-2601/
2026-01-03,Trump says 'we are going to run the country now' after ...,Political_Event,"President Trump says the United States conducted a strike in Venezuela and captured that country's president, Nicolás Maduro along with his wife, ...",https://www.wyomingpublicmedia.org/2026-01-03/trump-says-we-are-going-to-run-the-country-now-after-removing-venezuelas-president
2026-01-03,WATCH: Trump's remarks on the removal of Venezuelan ...,Political_Event,"President Trump says the United States conducted a strike in Venezuela and captured that country's president, Nicolás Maduro along with his wife, ...",https://www.npr.org/2026/01/03/g-s1-104346/trump-venezuela-maduro-press-conference
2026-01-03,Geopolitical Calendar,Holiday,The essential guide to the geopolitical events that will shape the global business environment in the coming year.,https://www.controlrisks.com/our-thinking/geopolitical-calendar
2026-01-03,Trump says 'we are going to run the country now' after ...,Political_Event,"President Trump says the United States conducted a strike in Venezuela and captured that country's president, Nicolás Maduro along with his wife, ...",https://laist.com/news/trump-says-we-are-going-to-run-the-country-now-after-removing-venezuelas-president
2026-01-03,Trump says US will run Venezuela after Maduro's 'capture',Political_Event,US says Venezuelan president will face drug-related charges in New York as Caracas decries Nicolas Maduro's capture. Published On 3 Jan 20263 Jan 2026.,https://www.aljazeera.com/news/liveblog/2026/1/3/live-loud-noises-heard-in-venezuelas-capital-amid-us-tensions
2026-01-03,A Timeline of Rising Tension Between the U.S. and ...,Political_Event,"President Trump on Saturday announced the capture of the authoritarian leader of Venezuela, Nicolás Maduro, in a U.S. military operation that appeared to be ...",https://www.nytimes.com/2026/01/03/world/americas/us-venezuela-tensions-timeline.html
2026-01-03,"New year, new Epstein transparency law, and Trump is ...",Holiday,The Epstein Files Transparency Act required all the Epstein files to be released on Dec. 19 with minimal redactions. The Department of Justice has refused ...,https://www.aol.com/articles/opinion-epstein-transparency-law-trump-183000049.html
2026-01-03,Holidays worldwide,Holiday,Public holidays and other special days in 200+ countries. Carefully researched and constantly updated.,https://www.timeanddate.com/holidays/
2026-01-03,Forget 2025: These 3 Growth Stocks Could Soar in 2026,Media_Reaction,"The Motley Fool has positions in and recommends Alphabet, Amazon, Apple, JPMorgan Chase, Mastercard, Microsoft, Netflix, Oracle, Visa, and Warner Bros.",https://www.nasdaq.com/articles/forget-2025-these-3-growth-stocks-could-soar-2026
2026-01-03,Oracle investors have questions about its spending,Media_Reaction,"Oracle shares slid more than 6% on Wednesday in after-hours trading, after the software giant posted revenue results that missed expectations.",https://www.aol.com/articles/oracle-misses-quarterly-revenue-questions-220527016.html
2026-01-03,Upcoming EU Public Holidays (European Union),Holiday,"Upcoming EU Public Holidays (January to November 2026) ; Sep 28, Monday, Czech Republic ; Oct 1, Thursday, Cyprus ; Oct 3, Saturday, Germany ; Oct 4, Sunday, Italy.",https://www.qppstudio.net/public-holidays/eu.htm
2026-01-03,A timeline of the US military's buildup and strikes against ...,Media_Reaction,A timeline of the US military's buildup and strikes against Venezuela leading to Maduro's capture. Supporters display a poster of Venezuelan President Nicolás ...,https://www.latimes.com/world-nation/story/2026-01-03/timeline-of-us-militarys-buildup-strikes-against-venezuela-leading-to-maduros-capture
2026-01-03,President Trump speaks live after US strikes Venezuela ; ...,Political_Event,"Trump updates the public after the U.S. captured President Maduro of Venezuela for narco-terrorism conspiracy and corruption charges in a ""large-scale""...",https://www.facebook.com/fox5atlanta/videos/president-trump-speaks-live-after-us-strikes-venezuela-captures-president-maduro/1158462432765327/
2026-01-03,Stock Market Holiday Calendar,Holiday,"Our Holiday Calendar tracks market closings for world holidays. Filter by countries and exchanges for a list of scheduled events, closing dates and times.",https://www.investing.com/holiday-calendar/
2026-01-03,Retail traders' favorite stocks best the market for third ...,Media_Reaction,"The opening trading day of 2026 was phenomenal for the AI picks and shovels trade, while very poor for their more downstream peers. How and why did this happen?",https://sherwood.news/markets/retail-traders-favorite-stocks-best-the-market-for-third-straight-year/
2026-01-03,2025 Holidays,Holiday,"2025 Holidays ; January 1, 2025, New Year's Day, Wednesday ; January 20, 2025, Martin Luther King Day, Monday ; January 20, 2025, Inauguration Day, Monday ; January ...",https://www.calendar-365.com/holidays/2025.html
